title,abstract,full_text
"SNet, a flexible, scalable network paradigm for manycore architectures.","A scalable communication paradigm for manycore architectures, called SNet (Scalable NETwork), is presented. It offers a wide range of flexibility by exploring the routing paths in a dynamic way, taking into consideration the network load. It is then followed by the data transmission phase through the chosen path.","SNet, a ﬂexible, Scalable NETwork paradigm for manycore architectures Celine Azar, Stephane Chevobbe, Yves Lhuillier Embedded Computing Laboratory, CEA, LIST, Gif-Sur-Yvette, F-91191, France; celine.azar, stephane.chevobbe, yves.lhuillier@cea.fr Jean-Philippe Diguet Lab-STICC, Universite de Bretagne Sud, Lorient, France; jean-philippe.diguet@univ-ubs.fr Abstract—A scalable communication paradigm for manycore architectures, called SNet (Scalable NETwork), is presented. It offers a wide range of ﬂexibility by exploring the routing paths in a dynamic way, taking into consideration the network load. It is then followed by the data transmission phase through the chosen path. Categories and Subject Descriptors. General Terms. Design Keywords. Manycore architectures, Scalable network I . IN TRODUC T ION Integrating thousands of IPs onto the same die becomes feasible with the 10 nm technology [1], which makes the computational resources cheaper considering their availability. One among the limits of these gigascale SoCs (System-On-Chip) will be the ability to efﬁciently interconnect pre-designed functional blocks and to accommodate their communication requirements in a scalable manner [2]. We propose to dedicate a set of Processing Elements (PE) to achieve routing tasks and a new PE co-processor, called DMC (Direct Management of Communications), to handle data transfers. With simple software libraries uploaded in PE memories, the user deﬁnes a speciﬁc topology, which is based on existing communication links between PEs. Then the routing is dynamic and implemented in a distributed manner in order to create paths from producer to consumer according to data dependencies.The whole concept is called Snet. I I . TH E SN E T CONC E PT The routing strategy in SNet, implemented in the software library, is based on a distributed ACO (Ant Colony Optimization) algorithm in which dynamic paths exploration is achieved in parallel for all communicating tasks. Paths search begins at the destination tasks to prevent round-trips. Destinations broadcast ant agents in the routing network to explore all courses to reach the source tasks following a priority order. If the ant reaches a dead end course, the corresponding path is dropped and the ant erases its traces back from the network. The routing strategy prohibits cyclic paths: a routing node is visited once by an ant, thus preventing deadlocks. All ants compute a cost function, that depends on the network load, and are compared regarding their costs at the source task. The optimal one is kept for data transmission, and the others erase their paths back to clean the network. The ﬁrst occurrence of the paths creation stage is considered as an initialization task that can be sought again at runtime to adapt the routing paths according to the actual system state and application needs. SNet is designed to be applied to any interconnection topology (mesh, torus, fat tree, etc...). In a considered topology, changing the conﬁguration of computing/routing nodes does not affect the implemented programs since the ACO algorithm is totally decorrelated from the physical placement of tasks. To validate the SNet concept, we have developed a manycore platform, which consists of an array of homogeneous RISC cores interconnected with their four neighbor cores in a mesh fashion. More details on the platform and the ACO algorithm are found in [3]. The SNet features are as follows: • Communication is achieved by loading a routing task, running the ACO algorithm, on an arbitrary set of cores. • The ACO algorithm handles dynamically paths creation among remote communicating tasks without usersupervision. • Once routing paths are dynamically created, data transfers are launched and handled by the DMC module. Multitasking in SNet may increase the utilization rate of the cores. Once the routing PEs are done of paths creation, they may switch to run either computing tasks or other control tasks, while the DMCs handle data transfers. They may also be switched off in order to reduce the power consumption. In the actual implementation of SNet, multitasking is not handled, but will be in future work. The DMC co-processor features a link table which is dynamically ﬁlled by the ACO algorithm during paths creation. It manages multiple requests arriving simultaneously while applying a round robin checking scheme. It requires one cycle per data transfer. The router area for SNet is equal to 0.014 mm2 at 40 nm TSMC. It includes one core area, to which we add the limited area of the DMC co-processor equal the overhead of the four shared buffers, linking each core to its four nearest neighbors. In the actual implementation of the platform, the chosen cores have a small footprint of 16 KGates and include a 4 KB instruction memory, and a 4 KB local data memory. When comparing it to state-of-art to 0.162 µm2 , and routers, it takes a middle range value between smaller ones such as XPIPES with 0.0104 mm2 , and larger ones such as AEthereal with 0.0234 mm2 at 40 nm TSMC. We conclude that the advantage of SNet is having a programmable, highly ﬂexible communication network scheme, while presenting a relatively small footprint router. I I I . R E SU LT S We follow hereby an evaluation methodology developed in [4] to extract the characteristics of different routing topologies applied to SNet, by setting ﬁxed simulation parameters to all tested topologies and modeling trafﬁc with Poisson injection distribution. 16 computational nodes are mapped to the platform, as shown in Figure 1, with a varying number of routing nodes. While this work addresses large systems, including thousands of cores, the limited platform dimensions considered hereby serve to characterize the SNet concept with acceptable simulation time. Each node of the platform injects 640 messages of n ﬂits in the network, the ﬂit width being 32 bits. In order to test the limits of the network saturation, n varies from 10 to 1000 f lits, which is equivalent to 25 KB and 2.44 M B respectively. The simulations are conducted on our ISS simulator, which is based on an ISS array of RISC processors and model one instruction per cycle. disposal of the routing tasks. When the computing tasks are distributed in a more-or-less uniform way, it results in a balanced network load. (a) Spatially Uniform Distribution (a) Square (b) Column (c) Cross (d) L (e) U (f) W (g) H (h) Bridge Fig. 1: Routing networks tested on the manycore platform. Dark gray refer to routing nodes, light gray to computing nodes, and white to unassigned cores. Measured latencies for the studied routing topologies under spatially uniform trafﬁc distribution are plotted in Figure 2a, whereas Figure 2-b shows results for best mapping in which each two communicating tasks are placed as close as possible. In the actual implementation, the network presents a bandwidth of 9.6 Gbps at 300 M H z , considering that one transmission can be achieved simultaneously by the DMC module. The minimum message latency depends on the routing paths computed at runtime. The starting value for the message latencies is quite the same for the two distributions, around 25 cycles. Maximum injection rates for spaced mappings range between 0.2 and 0.55, and between 0.4 and 0.9 for the best mappings. The different scored results are mainly due to the number of assigned routing cores. The higher this number is, the more possibilities are available to create routing paths, which reduces contentions. Another criteria lies on the spatial distribution of the computing tasks, which depends on the (b) Best Possible Distribution Fig. 2: Latency variation following the Poisson injection distribution. IV. CONCLU S ION S SNet efﬁciently implement a novel routing paradigm designed for scalability, ﬂexibility, and ease of programmability. It performs path exploration before data transmissions using the ACO distributed algorithm, without interrupting the application running. Results show that, though offering high ﬂexibility and scalability, SNet manages to score high injection rate values reaching 0.9, and low message latencies. In the next project steps, time reduction of the ACO paths creation stage will be feasible by introducing speciﬁc hardware modules for ant agents propagation. Multitasking execution will increase computing efﬁciency and pave the way of dynamic migration. "
3D logarithmic interconnect - Stacking multiple L1 memory dies over multi-core clusters.,"In this paper we propose two synthesizable 3D network architectures: C-LIN and D-LIN, which allow modular stacking of multiple L1 memory dies over a multi-core cluster with a limited number of processing elements (PEs). Two Through Silicon Via (TSV) technologies are used: the state of the art Micro-bumps and the promising and dense Cu-Cu Direct Bonding, with consideration of the ESD protection circuits. Our results demonstrate that, in processor-to-L1-memory context, C-LIN and D-LIN perform significantly better than traditional network on chips and simple time-division multiplexing buses, and they achieve comparable speed vs. their 2D counterparts, while enabling modularity: from 256KB to 2MB L1 memory configurations with a single mask set.","3D Logarithmic Interconnect: Stacking Multiple L1 Memory Dies Over Multi-Core Clusters Erfan Azarkhish, Igor Loi, and Luca Benini DEI, University of Bologna Bologna, Italy erfan.azarkhish@unibo.it, igor.loi@unibo.it, and luca.benini@unibo.it Abstract—In this paper we propose two synthesizable 3D network architectures: C-LIN and D-LIN, which allow modular stacking of multiple L1 memory dies over a multi-core cluster with a limited number of processing elements (PEs). Two Through Silicon Via (TSV) technologies are used: the state of the art Micro-bumps and the promising and dense Cu-Cu Direct Bonding, with consideration of the ESD protection circuits. Our results demonstrate that, in processor-to-L1-memory context, CLIN and D-LIN perform signiﬁcantly better than traditional network on chips and simple time-division multiplexing buses, and they achieve comparable speed vs. their 2D counterparts, while enabling modularity: from 256KB to 2MB L1 memory conﬁgurations with a single mask set. IN TRODUC T ION AND R E LAT ED WORK S I . Cluster-based many core design with a limited number of processors in each cluster, sharing tightly-coupled L1 data memories (TCDMs) has gained interest recently in programmable accelerators and embedded systems such as ST-Microelectronics Platform 2012/STHORM [1]. While network-on-chips (NoCs) are suitable for inter-cluster communication, cross-bar based interconnects seem to perform much better for intra-cluster communication since they provide a uniform and ultra-low latency memory access [2], [3]. However, since the reusability of custom designed crossbars such as [3] is limited across different technology nodes, synthesizable IPs are highly desirable in this context. Moreover, the advent of 3D technology has provided new opportunities to increase design modularity and reduce latency as well as manufacturing cost. In this paper, we take advantage of 3D technology to increase the shared L1 memory size in a modular fashion, i.e. stacking memory dies on top of a logic die, without the need to re-spin silicon. We focus on a single cluster with a typical size (16 PEs) sharing a tightly coupled multi-banked L1 memory, and propose two synthesizable 3D network architectures: C-LIN and D-LIN. While simulation results conﬁrm the superiority of LIN-based interconnects over traditional network on chips (NoC) and buses in processor-to-L1-memory context, post-layout results show that the these architectures increase design modularity over their 2D counterpart (2D-LIN), and provide the opportunity for further cost optimizations, while achieving comparable speed. 3D EX T EN S ION S TO 2D -L IN I I . The basic 2D Logarithmic Interconnect (2D-LIN) illustrated in Fig.1a) is designed following the Mesh Of Trees approach [4]. Centralized 3D-Logarithmic-Interconnect (C-LIN) and Distributed 3D-Logarithmic-Interconnect (D-LIN) are two extensions of the 2D-LIN to be integrated in a 3D-stacked Chip multiprocessor and to overcome the 2D limitation by splitting the design into one logic layer and several memory layers, and stacking them over each other. As illustrated in Fig.1b, in CLIN, the 2D design is cut at the memory interface, therefore, PEs and the interconnection network are placed on the logic layer, while memory modules along with small decoding logics are placed on memory layers. This way the logic and memory elements are completely separated and different technologies and optimizations may be utilized for design of the logic and memory dies. In the other alternative, D-LIN, 2D design is cut at the PE interface (See Fig.1c), therefore, interconnect is distributed among the layers. This will reduce the number of TSVs, since the number of slave channels is usually more than master channels (in order to reduce memory access conﬂicts). I I I . EX P ER IM EN TA L R E SU LT S Our baseline 2D-LIN conﬁguration is composed by 16 (STmicroelectronics xP70 ASIP RISC) PEs, sharing on-chip TCDM with 32 memory banks. Our design ﬂow is based on the STM CMOS-28nm Low Power technology library, with a Multi VT H synthesis ﬂow with Synopsys Design Compiler Graphical (2011.09), place and route with Cadence SoC Encounter Digital Implementation (10.1), and the sign-off tasks in Primetime (2011.09). Micro-bumps (with 40μm×50μm pitch) and Cu-Cu Direct Bonding (with 10μm × 10μm pitch) have been adopted from [5] (Capacitive load of TSVs is assumed to be 30fF), and ESD protection, glitch removal, and boot-time conﬁguration circuits to allow for identical layouts have been implemented as well (See Fig.2). Fig.3 compares execution time between LIN and a highperformance NoC [6] under random trafﬁc patterns. When WorkingSetSize is very small NoC performs slightly better than LIN. However, as PEs start to access remote banks, NoC’s execution time increases rapidly, while LIN starts to beneﬁt from load distribution among multiple banks. Table I compares performance between LIN, aforementioned NoC, and a simple bus, while some executing image processing benchmarks. In all cases LIN performs better than NoC, and bus results are an upper bound to the execution time. Post layout areas are also shown in table II. Fig.4a illustrates the silicon area (mm2 ) for 2D and 3D implementations. As can be seen, the 2D die size increases with the embedded on-chip SRAM, except for the ﬁrst two conﬁguration where PE obstructions and design geometry dominate the total design area. The resulting layouts after full placement and routing for D-LIN (Cu-Cu direct bonding) are depicted in Fig.5. Timing results are depicted in Fig.4b. It can be seen that, CLIN and D-LIN improve the performance over 2D-LIN with Logic Layer Mem Layer 1 Mem Layer 2 PE C Data MUX D Data MUX MM Bank1 Layer  Dcd T I Data D O Data Arbitration O Data MUX Data MUX MM Bank1 Layer  Dcd T I PE C Data MUX D Data MUX MM Bank2 Layer  Dcd T I Data O Data Arbitration O Data MUX Data MUX MM Bank2 Layer  Dcd T I 1 2 3 4 5 6 7 W I R I N G W I R I N G W I R I N G Request Response Data MUX Tree Response Block Address  Decoder Req Data MUX Tree Response Block Address  Decoder Req Test  &  Set Address Decoder Resp DMA PE Arbitration Tree Arbitration Tree Request Block l k Flow  Control Test  &  Set Address Decoder Resp DMA PE Arbitration Tree Arbitration Tree Request Block l k Flow  Control W I R I N G PE1 PEp Bank1 MM1 Bankm MMm a) b) c) Data MUX Data MUX Arbitration + Data Arbitration + Data MM Bank1 Layer  Dcd MM Bank2 Layer  Dcd 5 C C O O T T I I MM Bank1 Layer  Dcd T I MM Bank2 Layer  Dcd T I Logic Layer Mem Layer 1 Mem Layer 2 1 2 3 4 6 PE PE W I R I N G W I R I N G Request Response Fig. 1. Block diagrams of 2D-LIN (a), C-LIN (b), and D-LIN (c) e c a F t e c a F o Carrier c i e g t o a r L t s b u S D i O e To BGA Pads 0 Configuration MemLayers +1 LayerID T S V T S V T S V +1 LayerID T S SS V T S S V T S S V +1 LayerID T S V T S V T S V Req Block O C Resp Block T S V e c a F t k c a B o M e O m D i t a r 1 t s e b u S M e O m D i t a r 2 t s e b u S M e O m D i t a r 3 t s e b u S T S V T S V T S V Operation e S i 2 e e S i 2 S i 2 S i 2 T S V T S V I TMM Dcd T S V T S V I TMM Dcd T S V T S V I TMM Dcd PE Eni D I i t c a n e v e e v l t i E c A y a e Layer i  Data D l m n e t Enj Layer j  Data D V S T Glitch Removal Circuirty Fig. 2. Structure of the 3D stacking and conﬁguration circuitry TABLE I. B ENCHMARK EX ECU T ION T IM E COM PAR I SON Benchmarks  LIN Execution Time (ms)  AMAT (ns)  NoC Execution Time (ms)  AMAT (ns)  Bus Execution Time (ms)  AMAT (ns)  FAST  5.59  6.54  8.21  7.53  46.40  81.30  CT  SIFT  79.89  4464.07  6.47  6.46  106.92  4943.43  7.09  6.57  730.51 30799.99  82.40  81.90  the same memory size by small factors of 6.7% and 3.7% respectively, which is due to the large capacitive load of TSVs and overheads of the protection circuitry. This experiment shows that current TSVs are not yet scaled enough to provide a major performance boost over 2D planar designs. IV. CONC LU S ION We presented two synthesizable network architectures, CLIN and D-LIN which can be integrated with 3D Stacking technology to provide access to tightly coupled shared memory banks stacked over multi-core clusters. Our results demonstrated that in processor-to-L1-memory context, LIN outperforms both traditional NoCs and simple time-division multiplexing buses. Our modular design strategy allowed for stacking of multiple memory dies without the need for different masks, and offered better scalability with a similar performance compared to the 2D designs. It can be concluded that, even though the current TSVs are still not much better in terms of speed than global on-chip wires, they can provide more freedom in heterogeneous integration of dies with costoptimized technologies, since they are deﬁnitely much better than traditional off-chip links. ACKNOW L EDGM EN T This work has been supported by VIRTICAL EU project (CA n. 288574) and Phidias EU project (CA n. 318013). 120  110  100  90  80  70  60  50  40  0  50  100  150  Working Sets Size (KBytes)  200  250  o T t a l c e x E u i t T n o i m e ( S μ ) LIN  NoC  16KBytes  Fig. 3. Performance comparison between NoC and LIN TABLE II. PO S T- LAYOU T AR EA COM PAR I SON Interconnect  LIN  NoC-3.6GHz [8]   MIRA (3DM) [7]  MIRA (3DM-E) [7]  NoC-5.1GHz [6]  Cardinality Area (mm2)  (p=16,m=32)  0.09  4x4  0.29  4x4  0.40  4x4  0.98  4x4  1.02  18.0 16.0 14.0 12.0 10.0 8.0 6.0 4.0 2.0 0.0 256K 512K 1M 2M 256K 256K 256K 256K L Die M Die L Die M Die L Die M Die L Die M Die uBUMP Cu-Cu uBUMP Cu-Cu C-LIN D-LIN 2D 3D A r a e [ m m 2 ^ ] L Die: Logic Die M Die: Memory Die Memory Size 500 450 400 350 300 250 200 150 100 50 0 256K 512K 1M Memory Size 2M Up to 2M Up to 2M Up to 2M Up to 2M uBUMP Cu-Cu uBUMP Cu-Cu C-LIN D-LIN (8 Mem Layers) 2D 3D M x a i m u m [ y c n e u q e r F M H ] z a) b) Fig. 4. Silicon area (mm2 ) (a), Maximum frequency (MHz) (b)       	           	        	                      Fig. 5. Physical implementation of D-LIN: Landing pads (RDL), Logic Die (Cu-Cu Direct bonding), Memory die "
